rowNumber,normalizedLegacyId,proposedPartId,classification,reasonCode,reason
5,MIGFIX-RETIRED,MIGFIX-RETIRED,CONFLICT,TARGET_PART_INACTIVE,target part is DISCONTINUED
6,MIGFIX-NEW-3,MIGFIX-NEW-3,CONFLICT,ALIAS_OWNED_BY_OTHER_PART,legacySku alias belongs to part MIGFIX-OWNER
7,MIGFIX-MULTI,,CONFLICT,MULTIPLE_MATCHES,"identifier resolves to multiple Parts: MIGFIX-ALIASHOLDER, MIGFIX-MULTI"
9,MIGFIX-DUP-A,,CONFLICT,DUPLICATE_IPN_IN_FILE,normalized internalPartNumber already appears at row 8
11,MIGFIX-DUP-P2,MIGFIX-PID-1,CONFLICT,DUPLICATE_PART_ID_IN_FILE,partId already appears at row 10
12,MIGFIX-OWNER,MIGFIX-WRONG-ID,CONFLICT,IMMUTABLE_ID_MUTATION,row partId MIGFIX-WRONG-ID conflicts with resolved canonical MIGFIX-OWNER -- canonical identity is immutable
